{
 "schema": "ausmt-survey-metadata",
 "version": "0.1",
 "survey_id": "example-merged-release-2026",
 "title": "Example Merged Broadband MT Compilation",
 "dataset_version": "1.0.0",
 "dates": {
  "coverage": {
   "year_start": 2013,
   "year_end": 2018
  },
  "issued": "2026-08-01"
 },
 "identifiers": [
  {
   "scheme": "DOI",
   "identifier": "10.99999/ausmt-example-merged-2026"
  }
 ],
 "abstract": "A curated compilation merging two independently published broadband MT datasets into one new release (synthetic Case B fixture).",
 "subjects": [
  {
   "code": "370602",
   "scheme": "ANZSRC-FoR-2020"
  }
 ],
 "creators": [
  {
   "name": "Example Compiler",
   "name_type": "person",
   "orcid": "0000-0002-1825-0097"
  }
 ],
 "contributors": [
  {
   "name": "Example Geological Survey",
   "name_type": "organisation",
   "role": "DataCollector"
  }
 ],
 "organisations": [
  {
   "name": "Example Portal Operator",
   "roles": [
    "custodian",
    "publisher"
   ],
   "primary_custodian": true
  }
 ],
 "citation": {
  "preferred_identifier": {
   "scheme": "DOI",
   "identifier": "10.99999/ausmt-example-merged-2026"
  },
  "text_source": "ausmt_generated",
  "additional": [
   {
    "identifier": {
     "scheme": "DOI",
     "identifier": "10.99999/source-release-a"
    },
    "reason": "required_source_credit"
   },
   {
    "identifier": {
     "scheme": "DOI",
     "identifier": "10.99999/source-release-b"
    },
    "reason": "required_source_credit"
   }
  ]
 },
 "rights": {
  "license": "CC-BY-4.0",
  "access": "open"
 },
 "relationships": [
  {
   "identifier": "10.99999/source-release-a",
   "identifier_type": "DOI",
   "relation": "IsDerivedFrom"
  },
  {
   "identifier": "10.99999/source-release-b",
   "identifier_type": "DOI",
   "relation": "IsDerivedFrom"
  }
 ],
 "attribution": {
  "changes_made": true,
  "changes_summary": "Two source releases merged; stations re-identified; one invalid station removed."
 },
 "provenance": {
  "generated": "2026-08-22T00:00:00Z",
  "generator": "ausmt/extract.build_portal 0.2.1"
 }
}
