{
 "schema": "ausmt-survey-metadata",
 "version": "0.1",
 "survey_id": "example-programme-phase-1",
 "title": "Example Programme Phase 1 MT Survey",
 "dates": {
  "coverage": {
   "year_start": 2016,
   "year_end": 2019
  }
 },
 "identifiers": [
  {
   "scheme": "DOI",
   "identifier": "10.99999/example-phase-1-release"
  }
 ],
 "activities": [
  {
   "identifier": "https://raid.org/10.99999/programme",
   "scheme": "RAiD",
   "relation": "IsPartOf",
   "title": "Example national MT programme"
  },
  {
   "identifier": "https://raid.org/10.99999/phase-1-project",
   "scheme": "RAiD",
   "relation": "IsOutputOf",
   "title": "Example Phase 1 project"
  }
 ],
 "abstract": "A survey acquired under two related research activities (synthetic multi-activity fixture).",
 "subjects": [
  {
   "code": "370602",
   "scheme": "ANZSRC-FoR-2020"
  }
 ],
 "creators": [
  {
   "name": "Example Geological Survey",
   "name_type": "organisation",
   "ror": "https://ror.org/04ge02x20"
  }
 ],
 "organisations": [
  {
   "name": "Example Geological Survey",
   "roles": [
    "custodian",
    "publisher"
   ],
   "primary_custodian": true
  }
 ],
 "funders": [
  {
   "name": "Example Exploration Initiative",
   "award_number": "EXI-2016-01",
   "award_title": "Example Phase 1 funding"
  }
 ],
 "citation": {
  "preferred_identifier": {
   "scheme": "DOI",
   "identifier": "10.99999/example-phase-1-release"
  },
  "text_source": "ausmt_generated"
 },
 "rights": {
  "license": "CC-BY-4.0",
  "access": "open"
 },
 "extent": {
  "bbox": {
   "west": 129.0,
   "south": -26.0,
   "east": 138.0,
   "north": -12.0
  }
 },
 "provenance": {
  "generated": "2026-08-22T00:00:00Z",
  "generator": "ausmt/extract.build_portal 0.2.1"
 }
}
